{
  "$schema": "https://json-schema.org/draft/2020-12/schema",
  "title": "Schema for wmapConfig.json",
  "type": "object",
  "properties": {
    "buildingSymbol": {
      "type": "string",
      "minLength": 1,
      "maxLength": 1,
      "description": "Symbol used to denote buildings in the ASCII map.",
      "default":"$"
    },
    "junctionSymbol": {
      "type": "string",
      "minLength": 1,
      "maxLength": 1,
      "description": "Symbol used to denote junctions in the ASCII map. Junctions are cells where an actor can change direction.",
      "default":"+"
    },
    "colliders":{
        "type":"array",
        "items": {
            "type":"string",
            "maxLength": 1,
            "minLength": 1
        },
        "default": ["|", "-", "/", "\\"],
        "minItems": 1,
        "maxItems": 255,
        "description": "Symbols that the actors will collide with."
    },
    "wordSize":{
        "type":"object",
        "properties": {
            "baseAddressSize":{
                "type":"integer",
                "default":5,
                "description": "building code",
                "minimum": 0
            },
            "subAddressSize":{
                "type":"integer",
                "default":11,
                "description": "address of the specific word in the building.",
                "minimum":0
            }
        },
        "required": ["baseAddressSize", "subAddressSize"],
        "description": "word size for primary memory."
    },
    "spawn":{
        "type":"object",
        "properties": {
            "x":{
                "type":"integer",
                "description": "x coordinate of spawn point of actors. x=0 is left border of map",
                "minimum": 0
            },
            "y":{
                "type":"integer",
                "description": "y coordinate of spawn point of actors. y=0 is top border of map",
                "minimum": 0
            },
            "direction":{
                "type":"string",
                "enum":["<", ">", "v", "^"],
                "description": "default direction the actors will move in upon spawning. <: left, >: right, v: down, ^: up"
            }
        },
        "required": ["x", "y", "direction"]
    },
    "buildings":{
        "type": "array",
        "items":{
            "type":"object",
            "properties": {
                "FUNC":{
                    "type":"object",
                    "properties": {
                        "opcodeList":{
                            "type":"array",
                            "description": "OPCODE array for function.",
                            "items": {
                                "type":"string",
                                "minLength": 1
                            }
                        }
                    },
                    "required": ["opcodeList"],
                    "description": "Function."
                },
                "MEM":{
                    "type":"object",
                    "properties": {
                        "baseAddress":{
                            "type":"string",
                            "description": "Base address for building.",
                            "minLength": 1
                        },
                        "size":{
                            "type":"integer",
                            "description": "Number of words this building has."
                        }
                    },
                    "required": ["baseAddress", "size"],
                    "description": "Memory."
                },
                "REG":{
                    "type":"object",
                    "properties": {
                        "regName":{
                            "type":"string",
                            "description": "Name of register for building.",
                            "minLength": 1
                        }
                    },
                    "required": ["regName"],
                    "description": "Register."
                }
            },
            "oneOf": [
                {"required":["FUNC"]},
                {"required": ["MEM"]},
                {"required": ["REG"]}
            ]
        }
    }
  },
  "required": ["buildings", "spawn", "buildingSymbol", "junctionSymbol", "colliders", "wordSize"]
}