{
    "$schema": "./wmapConfig.schema.json",
    "buildingSymbol": "$",
    "junctionSymbol": "+",
    "colliders":  ["|", "-", "/", "\\"],
    "wordSize": {
        "baseAddressSize": 2,
        "subAddressSize": 14
    },
    "spawn": {
        "x": 60,
        "y": 112,
        "direction": ">"
    },
    "buildings": [
        {
            "MEM": {
                "baseAddress": "CO",
                "size": 40
            }
        },
        {
            "REG": {
                "regName": "AMUL"
            }
        },
        {
            "FUNC": {
                "opcodeList": [
                    "ADD",
                    "MULT"
                ]
            }
        },
        {
            "FUNC": {
                "opcodeList": [
                    "ADD",
                    "MULT"
                ]
            }
        },
        {
            "FUNC": {
                "opcodeList": [
                    "ADD",
                    "MULT"
                ]
            }
        },
        {
            "FUNC": {
                "opcodeList": [
                    "ADD"
                ]
            }
        },
        {
            "FUNC": {
                "opcodeList": [
                    "ADD"
                ]
            }
        },
        {
            "REG": {
                "regName": "COUNTRYOVEN"
            }
        },
        {
            "FUNC": {
                "opcodeList": [
                    "ADD",
                    "MULT"
                ]
            }
        },
        {
            "FUNC": {
                "opcodeList": [
                    "ADD"
                ]
            }
        },
        {
            "FUNC": {
                "opcodeList": [
                    "ADD"
                ]
            }
        },
        {
            "FUNC": {
                "opcodeList": [
                    "ADD",
                    "MULT"
                ]
            }
        },
        {
            "FUNC": {
                "opcodeList": [
                    "ADD"
                ]
            }
        },
        {
            "FUNC": {
                "opcodeList": [
                    "ADD"
                ]
            }
        },
        {
            "FUNC": {
                "opcodeList": [
                    "ADD",
                    "MULT"
                ]
            }
        },
        {
            "FUNC": {
                "opcodeList": [
                    "ADD"
                ]
            }
        },
        {
            "FUNC": {
                "opcodeList": [
                    "ADD"
                ]
            }
        },
        {
            "FUNC": {
                "opcodeList": [
                    "ADD",
                    "MULT"
                ]
            }
        },
        {
            "FUNC": {
                "opcodeList": [
                    "ADD"
                ]
            }
        },
        {
            "FUNC": {
                "opcodeList": [
                    "ADD"
                ]
            }
        },
        {
            "FUNC": {
                "opcodeList": [
                    "ADD",
                    "MULT"
                ]
            }
        },
        {
            "FUNC": {
                "opcodeList": [
                    "ADD"
                ]
            }
        },
        {
            "FUNC": {
                "opcodeList": [
                    "ADD"
                ]
            }
        },
        {
            "FUNC": {
                "opcodeList": [
                    "ADD",
                    "MULT"
                ]
            }
        },
        {
            "FUNC": {
                "opcodeList": [
                    "ADD"
                ]
            }
        },
        {
            "FUNC": {
                "opcodeList": [
                    "ADD"
                ]
            }
        },
        {
            "FUNC": {
                "opcodeList": [
                    "ADD",
                    "MULT"
                ]
            }
        },
        {
            "FUNC": {
                "opcodeList": [
                    "ADD"
                ]
            }
        },
        {
            "FUNC": {
                "opcodeList": [
                    "ADD"
                ]
            }
        },
        {
            "FUNC": {
                "opcodeList": [
                    "ADD",
                    "MULT"
                ]
            }
        },
        {
            "FUNC": {
                "opcodeList": [
                    "ADD"
                ]
            }
        },
        {
            "FUNC": {
                "opcodeList": [
                    "ADD"
                ]
            }
        },
        {
            "FUNC": {
                "opcodeList": [
                    "ADD",
                    "MULT"
                ]
            }
        },
        {
            "FUNC": {
                "opcodeList": [
                    "ADD"
                ]
            }
        },
        {
            "FUNC": {
                "opcodeList": [
                    "ADD"
                ]
            }
        },
        {
            "FUNC": {
                "opcodeList": [
                    "ADD",
                    "MULT"
                ]
            }
        },
        {
            "FUNC": {
                "opcodeList": [
                    "ADD"
                ]
            }
        },
        {
            "FUNC": {
                "opcodeList": [
                    "ADD"
                ]
            }
        },
        {
            "FUNC": {
                "opcodeList": [
                    "ADD",
                    "MULT"
                ]
            }
        },
        {
            "FUNC": {
                "opcodeList": [
                    "ADD"
                ]
            }
        },
        {
            "FUNC": {
                "opcodeList": [
                    "ADD"
                ]
            }
        },
        {
            "FUNC": {
                "opcodeList": [
                    "ADD",
                    "MULT"
                ]
            }
        },
        {
            "FUNC": {
                "opcodeList": [
                    "ADD"
                ]
            }
        },
        {
            "FUNC": {
                "opcodeList": [
                    "ADD"
                ]
            }
        },
        {
            "FUNC": {
                "opcodeList": [
                    "ADD",
                    "MULT"
                ]
            }
        },
        {
            "FUNC": {
                "opcodeList": [
                    "ADD"
                ]
            }
        },
        {
            "FUNC": {
                "opcodeList": [
                    "ADD"
                ]
            }
        },
        {
            "FUNC": {
                "opcodeList": [
                    "ADD",
                    "MULT"
                ]
            }
        },
        {
            "FUNC": {
                "opcodeList": [
                    "ADD"
                ]
            }
        },
        {
            "FUNC": {
                "opcodeList": [
                    "ADD"
                ]
            }
        },
        {
            "FUNC": {
                "opcodeList": [
                    "ADD",
                    "MULT"
                ]
            }
        },
        {
            "FUNC": {
                "opcodeList": [
                    "ADD"
                ]
            }
        },
        {
            "FUNC": {
                "opcodeList": [
                    "ADD"
                ]
            }
        },
        {
            "FUNC": {
                "opcodeList": [
                    "ADD",
                    "MULT"
                ]
            }
        },
        {
            "FUNC": {
                "opcodeList": [
                    "ADD"
                ]
            }
        },
        {
            "FUNC": {
                "opcodeList": [
                    "ADD"
                ]
            }
        }
    ]
}